{
  "op": "report_state_observation",
  "frame_id": 7,
  "sent_at": "2026-10-31T00:00:00Z",
  "body": {
    "agent_id": "agent-a",
    "session_id": "session-1",
    "observation_id": "observation-1",
    "observed_at": "2026-10-31T00:00:00Z",
    "harness": "codex",
    "harness_version": "1.0",
    "observation_generation": 1,
    "output_generation": 0,
    "event_generation": 0,
    "input_guard_version": 0,
    "screen_state": "WITHHELD",
    "screen_rows": [],
    "cols": 0,
    "activity": {
      "bytes_last_500ms": 0,
      "bytes_last_2s": 0,
      "bytes_last_10s": 0,
      "seconds_since_last_output": 0
    },
    "native_events": []
  }
}
